{
    "profile": {
        "name": "Michele Rizzello",
        "description": "Michele Rizzello : Enseignant, Chimiste, Chef de projet technique, Développeur Web Full Stack, Graphiste",
        "location": "Genève, CH",
        "subtitles": [
            "Enseignant",
            "Chimiste - Ingénieur ETS",
            "Développeur Web",
            "Graphiste"
        ],
        "skills": {
            "hardSkills": {
                "title": "Compétences clés",
                "items": [
                    "Engagement dans des démarches d'innovation ou de recherche.",
                    "Recours à des approches interdisciplinaires.",
                    "Conception et développement de solutions informatiques.",
                    "Conduite de projet et encadrement d’équipes."
                ]
            },
            "softSkills": {
                "title": "Compétences personnelles",
                "items": [
                    "Motivation pour les problématiques didactiques et pédagogiques.",
                    "Sens de l’écoute et de la communication.",
                    "Capacités d’organisation et sens des responsabilités.",
                    "Capacité d'adaptation et créativité."
                ]
            }
        },
        "tools": {
            "Programmation": {
                "PHP": {
                    "level": 100,
                    "comment": "Expert"
                },
                "Javascript": {
                    "level": 100,
                    "comment": "Expert"
                },
                "Typescript": {
                    "level": 80,
                    "comment": "Avancé"
                },
                "Python": {
                    "level": 75,
                    "comment": "Intermédiaire"
                }
            },
            "CMS": {
                "Drupal": {
                    "level": 100,
                    "comment": "Expert"
                },
                "Magento": {
                    "level": 66,
                    "comment": "Intermédiaire"
                },
                "Grav CMS": {
                    "level": 66,
                    "comment": "Intermédiaire"
                },
                "Wordpress": {
                    "level": 30,
                    "comment": "Novice"
                }
            },
            "Frameworks": {
                "Angular": {
                    "level": 90,
                    "comment": "Avancé"
                },
                "Symfony": {
                    "level": 80,
                    "comment": "Avancé"
                },
                "Yii": {
                    "level": 75,
                    "comment": "Intermédiaire"
                },
                "Slim": {
                    "level": 75,
                    "comment": "Intermédiaire"
                }
            },
            "Frontend": {
                "Sass": {
                    "level": 90,
                    "comment": "Avancé"
                },
                "Gulp": {
                    "level": 90,
                    "comment": "Avancé"
                },
                "Foundation": {
                    "level": 90,
                    "comment": "Avancé"
                },
                "Bootstrap": {
                    "level": 90,
                    "comment": "Avancé"
                }
            }
        },
        "languages": {
            "en": {
                "label": "Anglais",
                "comment": "Expérimenté",
                "level": 90
            },
            "fr": {
                "label": "Français",
                "comment": "Langue maternelle",
                "level": 100
            },
            "it": {
                "label": "Italien",
                "comment": "Bilingue",
                "level": 100
            },
            "es": {
                "label": "Espagnol",
                "comment": "Conversation",
                "level": 30
            },
            "de": {
                "label": "Allemand",
                "comment": "De survie...",
                "level": 10
            }
        },
        "locations": [
            {
                "id": "ge1",
                "label": "Genève",
                "bgcolor": "#4a4a4a",
                "begin": "1990-01-01",
                "end": "2005-02-05"
            },
            {
                "id": "pa1",
                "label": "Paris",
                "bgcolor": "#707070",
                "begin": "2005-02-05",
                "end": "2013-02-05"
            },
            {
                "id": "ge2",
                "label": "Genève",
                "bgcolor": "#4a4a4a",
                "begin": "2013-02-05",
                "end": "2019-07-01"
            },
            {
                "id": "vd1",
                "label": "Vaud",
                "bgcolor": "#707070",
                "begin": "2019-07-01",
                "end": null
            }
        ],
        "social": [
            {
                "label": "Email",
                "href": "mailto:m@rizzello.me",
                "icon": "envelope-square.svg"
            },
            {
                "label": "LinkedIn",
                "href": "https://linkedin.com/in/mrizzello",
                "icon": "linkedin.svg"
            },
            {
                "label": "Twitter",
                "href": "https://twitter.com/michelerizzello",
                "icon": "twitter-square.svg"
            },
            {
                "label": "Facebook",
                "href": "https://www.facebook.com/michelerizzello",
                "icon": "facebook-square.svg"
            }
        ],
        "sections": {
            "cv": "Expérience",
            "edu": "Formation",
            "timeline": "Timeline",
            "tools": "Informatique",
            "languages": "Langues",
            "projects": "Projets"
        }
    },
    "cv": [
        {
            "id": "eig",
            "order": 1,
            "title": "Assistanat de laboratoire de Chimie",
            "employer": "DIP - Ecole d'Ingénieurs de Genève",
            "contract": "CDD",
            "type": "chem",
            "city": "Genève (CH)",
            "tools": [],
            "begin": "1999-11-01",
            "end": "2004-08-01",
            "content": "<p>Assistanat de laboratoire de Chimie - étudiants 1ère et 2ème année</p>\n<ul>\n<li>Encadrement et animation des laboratoires de chimie et enseignement des connaissances chimiques et techniques aux étudiants</li>\n<li>Groupes de 12 étudiants de 15 à 18 ans</li>\n<li>Correction des rapports des travaux pratiques et évaluation des connaissances des étudiants lors des examens oraux</li>\n<li>Remplacements dans divers établissements secondaires du canton</li>\n</ul>",
            "projects": []
        },
        {
            "id": "graphiste",
            "order": 2,
            "title": "Activité indépendante",
            "employer": "Graphiste",
            "contract": "Indépendant",
            "type": "de",
            "city": "Genève (CH)",
            "tools": [
                "Drupal 7",
                "Drupal 6",
                "Yii"
            ],
            "begin": "2004-09-01",
            "end": "2007-05-21",
            "content": "<ul>\n<li>Impression: Création d'affiches, flyers, brochures, couvertures de livres, identités visuelles</li>\n<li>Événement: Création de scénographies, visuels pour conférences</li>\n<li>Institutionnel: Création et développement Flash</li>\n<li>Web: Création graphique, développement et intégration</li>\n</ul>",
            "projects": [
                {
                    "title": "Fêtons Linux",
                    "urls": [
                        "http://www.fetonslinux.ch"
                    ],
                    "tools": [
                        "Drupal 7"
                    ],
                    "content": "<ul>\n<li>Conception du logo et de la charte graphique de l'événement</li>\n<li>Déclinaison de la charte graphique sur différents supports (affiche, flyers, bannières)</li>\n<li>Création et développement du site internet</li>\n<li>Création d'un module de réservation de présence pour les ateliers</li>\n<li>Création de l'application Android de l'événement</li>\n</ul>"
                },
                {
                    "title": "Theatre les 50",
                    "urls": [
                        "http://www.theatreles50.fr"
                    ],
                    "tools": [
                        "Drupal 7",
                        "Yii"
                    ],
                    "content": "<ul>\n<li>Conception du logo de la compagnie et déclinaison de la charte graphique</li>\n<li>Création des affiches et flyers de la compagnie théâtrale</li>\n<li>Création du site internet de la compagnie</li>\n<li>Création d'une centrale de réservation en ligne pour les spectacles de la compagnie</li>\n</ul>"
                },
                {
                    "title": "Jean-Marie Heidinger",
                    "urls": [
                        "http://www.heidingerjm.com"
                    ],
                    "tools": [
                        "Drupal 7"
                    ],
                    "content": "<ul>\n<li>Création du site internet pour un photographe indépendant</li>\n</ul>"
                },
                {
                    "title": "Plein Feu",
                    "urls": [
                        "http://www.pleinfeu.fr"
                    ],
                    "tools": [
                        "Drupal 6"
                    ],